{
  "schemaVersion": 1,
  "templateId": "cpu-memory/regression-diagnosis",
  "title": "The Profiler Says Nothing Broke",
  "domainId": "cpu-memory",
  "concepts": [
    {
      "id": "cpu-cache-miss",
      "tier": 2
    },
    {
      "id": "os-sched",
      "tier": 2
    }
  ],
  "prerequisiteConceptIds": [
    "cpu-cache-levels"
  ],
  "objective": "Diagnose why the hot loop regressed by inspecting counters and running counterfactuals, then commit to exactly one root cause.",
  "seed": "golden-phase-change-4-2",
  "difficulty": {
    "band": 4,
    "relevantVariables": 8,
    "distractorHypotheses": 3,
    "causalDepth": 3,
    "observability": 0.53,
    "minInvestigations": 3
  },
  "briefing": "A routine profiling pass shows the hot loop of your feature-extractor service has regressed measurably since yesterday's build.\n\nThe change list mentions a data-layout tweak and a library bump, neither of which touches this loop's code path.\n\nThe machine has a 16 KiB, 64 B-line, 8-way cache where the loop lives. Nothing else changed.\n\nProfiling reruns are expensive: you have a fixed budget of probes before you must commit.",
  "hidden": {
    "causeId": "phase-change",
    "parameters": {
      "geometry": {
        "sizeBytes": 16384,
        "lineSizeBytes": 64,
        "associativity": 8
      },
      "workload": {
        "phases": [
          {
            "label": "phase-a",
            "addrs": [
              4194304,
              4194368,
              4194432,
              4194496,
              4194560,
              4194624,
              4194688,
              4194752,
              4194816,
              4194880,
              4194944,
              4195008,
              4195072,
              4195136,
              4195200,
              4195264,
              4195328,
              4195392,
              4195456,
              4195520,
              4195584,
              4195648,
              4195712,
              4195776,
              4195840,
              4195904,
              4195968,
              4196032,
              4196096,
              4196160,
              4196224,
              4196288,
              4194304,
              4194368,
              4194432,
              4194496,
              4194560,
              4194624,
              4194688,
              4194752,
              4194816,
              4194880,
              4194944,
              4195008,
              4195072,
              4195136,
              4195200,
              4195264,
              4195328,
              4195392,
              4195456,
              4195520,
              4195584,
              4195648,
              4195712,
              4195776,
              4195840,
              4195904,
              4195968,
              4196032,
              4196096,
              4196160,
              4196224,
              4196288,
              4194304,
              4194368,
              4194432,
              4194496,
              4194560,
              4194624,
              4194688,
              4194752,
              4194816,
              4194880,
              4194944,
              4195008,
              4195072,
              4195136,
              4195200,
              4195264,
              4195328,
              4195392,
              4195456,
              4195520,
              4195584,
              4195648,
              4195712,
              4195776,
              4195840,
              4195904,
              4195968,
              4196032,
              4196096,
              4196160,
              4196224,
              4196288,
              4194304,
              4194368,
              4194432,
              4194496,
              4194560,
              4194624,
              4194688,
              4194752,
              4194816,
              4194880,
              4194944,
              4195008,
              4195072,
              4195136,
              4195200,
              4195264,
              4195328,
              4195392,
              4195456,
              4195520,
              4195584,
              4195648,
              4195712,
              4195776,
              4195840,
              4195904,
              4195968,
              4196032,
              4196096,
              4196160,
              4196224,
              4196288,
              4194304,
              4194368,
              4194432,
              4194496,
              4194560,
              4194624,
              4194688,
              4194752,
              4194816,
              4194880,
              4194944,
              4195008,
              4195072,
              4195136,
              4195200,
              4195264,
              4195328,
              4195392,
              4195456,
              4195520,
              4195584,
              4195648,
              4195712,
              4195776,
              4195840,
              4195904,
              4195968,
              4196032,
              4196096,
              4196160,
              4196224,
              4196288,
              4194304,
              4194368,
              4194432,
              4194496,
              4194560,
              4194624,
              4194688,
              4194752,
              4194816,
              4194880,
              4194944,
              4195008,
              4195072,
              4195136,
              4195200,
              4195264,
              4195328,
              4195392,
              4195456,
              4195520,
              4195584,
              4195648,
              4195712,
              4195776,
              4195840,
              4195904,
              4195968,
              4196032,
              4196096,
              4196160,
              4196224,
              4196288
            ],
            "reps": 1
          },
          {
            "label": "phase-b",
            "addrs": [
              6815744,
              6815936,
              6816128,
              6816320,
              6816512,
              6816704,
              6816896,
              6817088,
              6817280,
              6817472,
              6817664,
              6817856,
              6818048,
              6818240,
              6818432,
              6818624,
              6818816,
              6819008,
              6819200,
              6819392,
              6819584,
              6819776,
              6819968,
              6820160,
              6820352,
              6820544,
              6820736,
              6820928,
              6821120,
              6821312,
              6821504,
              6821696,
              6821888,
              6822080,
              6822272,
              6822464,
              6822656,
              6822848,
              6823040,
              6823232,
              6823424,
              6823616,
              6823808,
              6824000,
              6824192,
              6824384,
              6824576,
              6824768,
              6824960,
              6825152,
              6825344,
              6825536,
              6825728,
              6825920,
              6826112,
              6826304,
              6826496,
              6826688,
              6826880,
              6827072,
              6827264,
              6827456,
              6827648,
              6827840,
              6828032,
              6828224,
              6828416,
              6828608,
              6828800,
              6828992,
              6829184,
              6829376,
              6829568,
              6829760,
              6829952,
              6830144,
              6830336,
              6830528,
              6830720,
              6830912,
              6831104,
              6831296,
              6831488,
              6831680,
              6831872,
              6832064,
              6832256,
              6832448,
              6832640,
              6832832,
              6833024,
              6833216,
              6833408,
              6833600,
              6833792,
              6833984,
              6834176,
              6834368,
              6834560,
              6834752,
              6834944,
              6835136,
              6835328,
              6835520,
              6835712,
              6835904,
              6836096,
              6836288,
              6836480,
              6836672,
              6836864,
              6837056,
              6837248,
              6837440,
              6837632,
              6837824,
              6838016,
              6838208,
              6838400,
              6838592,
              6838784,
              6838976,
              6839168,
              6839360,
              6839552,
              6839744,
              6839936,
              6840128,
              6840320,
              6840512,
              6840704,
              6840896,
              6841088,
              6841280,
              6841472,
              6841664,
              6841856,
              6842048,
              6842240,
              6842432,
              6842624,
              6842816,
              6843008,
              6843200,
              6843392,
              6843584,
              6843776,
              6843968,
              6844160,
              6844352,
              6844544,
              6844736,
              6844928,
              6845120,
              6845312,
              6845504,
              6845696,
              6845888,
              6846080,
              6846272,
              6846464,
              6846656,
              6846848,
              6847040,
              6847232,
              6847424,
              6847616,
              6847808,
              6848000,
              6848192,
              6848384,
              6848576,
              6848768,
              6848960,
              6849152,